### ISSUE TITLE
js9Helper / fits2fits woes

### ISSUE THREAD

**Issue by o-smirnov** [gijzelaerr/js9notebook#5]
Sorry @ericmandel, I'm struggling to get fits2fits to work, or wrap my head around it.

Firstly, a conceptual problem. [Here you say](https://github.com/gijzelaerr/js9notebook/issues/2#issuecomment-402512755) "the browser knows to ask the js9 helper to extract a smaller file for display from the original file (which is one the server)", but in [this comment](https://github.com/gijzelaerr/js9notebook/issues/2#issuecomment-402473578) you tell me to "...Using js9prefs.js in Jupyter, you'll need to turn off the helper". So if I do that, who's the browser going to ask for a smaller file?

I have tried to re-enable the helper -- but when I have ``JS9.Load("my_fits_file.fits", {fits2fits:true})`` in my script, I get this on the console:

```
js9.min.js:410 Uncaught TypeError: Cannot read property 'image' of undefined
    at Object.b.fits2RepFile (VM193 js9.min.js:410)
    at Object.Load (VM193 js9.min.js:587)
    at loadIm (3C147-CD-LO-spw0-s7-lwimager.fullrest.js9-inline.html:44)
b.fits2RepFile @ js9.min.js:410
(anonymous) @ js9.min.js:587
loadIm @ 3C147-CD-LO-spw0-s7-lwimager.fullrest.js9-inline.html:44
setTimeout (async)
(anonymous) @ 3C147-CD-LO-spw0-s7-lwimager.fullrest.js9-inline.html:43
```

A simple ``JS9.Load("my_fits_file.fits")`` works fine.

**Comment by ericmandel** [comment]
We're getting confused between different conversations. You definitely need a helper to be running. Advice to turn off the helper at various points in the conversation was part of testing different aspects of the Tornado problem, trying to see what worked and what did not work.

I've just updated GitHub, and will write about how far I've gotten in the appropriate issue.

**Comment by o-smirnov** [comment]
Good news is, I've got the helper working (note to others: the ``nodejs`` package in Ubuntu 16.04 is too old to run it right. Need to install an updated version from https://nodejs.org. Ubuntu 18.04 already has a sufficiently new version, I think). I can upload files. So far so good.

But, I can't get fits2fits to work as intended. I'm following https://js9.si.edu/js9/help/repfile.html, and @ericmandel's comment [here](https://github.com/gijzelaerr/js9notebook/issues/2#issuecomment-402473578).

So firstly https://js9.si.edu/js9/help/repfile.html is a bit incorrect, it says to modify ``js9Prefs.json``, but in fact ``j9prefs.js`` also needs the "image" option set (or is the latter meant to be auto-generated from the former somehow?)

Having set things up like this:
```
{
  "globalOpts":
  {
    "helperType":      "nodejs",
    "helperPort":       2718,
    "helperCGI":        "./cgi-bin/js9/js9Helper.cgi",
    "fits2png":         false,
    "debug":            10,
    "loadProxy":        true,
    "useWasm":          false,
    "workDir":          ".radiopadre",
    "workDirQuota":     500,
    "dataPath":         ".",
    "analysisPlugins":  "./analysis-plugins",
    "analysisWrappers": "./analysis-wrappers",
    "fits2fits":        "always",
    "image":
    {
      "xdim": 256,
      "ydim": 256,
      "bin":  1
    }
  },
  "imageOpts":
  {
    "colormap":       "grey",
    "scale":          "linear"
  }
}
```
I then expect ``JS9.Load("/./3C147-CD-LO-spw0-s7-lwimager.fullrest.fits", {fits2fits:true});`` on the client to only fetch a tiny representation file. But I can see in the network console that the entire 129MB original FITS file is being fetched:

![image](https://user-images.githubusercontent.com/6470079/42321791-63ed1aa2-805a-11e8-9e02-dafb340ac278.png)

...although what then gets displayed is the 256x256 cutout.

What am I missing here?

**Comment by o-smirnov** [comment]
Following the example URLs here https://js9.si.edu/js9/js9large.html, I've tried

```
JS9.Load("/./3C147-CD-LO-spw0-s7-lwimager.fullrest.fits",{fits2fits:true,xcen:2048,ycen:1024,xdim:256,ydim:256,bin:4})
```

but I still get a full download. If I check the log of the helper process, I see it chattering about fits2fits:

```
  engine:ws received "421["fits2fits",{"sect":"256@2048,256@1024,4","fits":"/3C147-CD-LO-spw0-s7-lwimager.fullrest.fits","parent":true,"cookie":"_xsrf=2|89506d0f|3a80c841be4330ee255e237b763d1d24|1530023674","dataPath":".:.:/.../../"}]" +877ms
  engine:socket packet +1ms
  socket.io-parser decoded 21["fits2fits",{"sect":"256@2048,256@1024,4","fits":"/3C147-CD-LO-spw0-s7-lwimager.fullrest.fits","parent":true,"cookie":"_xsrf=2|89506d0f|3a80c841be4330ee255e237b763d1d24|1530023674","dataPath":".:.:/.../../"}] as {"type":2,"nsp":"/","id":1,"data":["fits2fits",{"sect":"256@2048,256@1024,4","fits":"/3C147-CD-LO-spw0-s7-lwimager.fullrest.fits","parent":true,"cookie":"_xsrf=2|89506d0f|3a80c841be4330ee255e237b763d1d24|1530023674","dataPath":".:.:/.../../"}]} +0ms
  socket.io:socket got packet {"type":2,"nsp":"/","id":1,"data":["fits2fits",{"sect":"256@2048,256@1024,4","fits":"/3C147-CD-LO-spw0-s7-lwimager.fullrest.fits","parent":true,"cookie":"_xsrf=2|89506d0f|3a80c841be4330ee255e237b763d1d24|1530023674","dataPath":".:.:/.../../"}]} +0ms
  socket.io:socket emitting event ["fits2fits",{"sect":"256@2048,256@1024,4","fits":"/3C147-CD-LO-spw0-s7-lwimager.fullrest.fits","parent":true,"cookie":"_xsrf=2|89506d0f|3a80c841be4330ee255e237b763d1d24|1530023674","dataPath":".:.:/.../../"}] +0ms
  socket.io:socket attaching ack callback to event +0ms
  socket.io:socket dispatching an event ["fits2fits",{"sect":"256@2048,256@1024,4","fits":"/3C147-CD-LO-spw0-s7-lwimager.fullrest.fits","parent":true,"cookie":"_xsrf=2|89506d0f|3a80c841be4330ee255e237b763d1d24|1530023674","dataPath":".:.:/.../../"},null] +0ms
  socket.io:socket sending ack [{"stdout":"/3C147-CD-LO-spw0-s7-lwimager.fullrest.fits","stderr":null,"errcode":0,"encoding":"ascii"}] +0ms
```

...but I don't observe the intended effect. Nor is there any sign of activity in the working directory server-side.

**Comment by ericmandel** [comment]
In the node log, you should see an exec command like this:
````
exec: /Users/eric/js9/analysis-wrappers/js9Xeq [imsection,-parent,fits/casa.fits[events][energy=3000:7000],700@3888,600@4098,2]  [2018-7-5 09:43:33]
````
Its presence would tell us that node exec'ed the imsection command, which runs the script:
````
analysis-wrappers/js9Xeq
````
with the specified arguments.

Once you have verified that js9Xeq was run, the easiest thing to do is to edit js9Xeq and uncomment the lines at the top (edit the path of the file as needed):
````
# set -x
# exec 2>$HOME/foo.log
````
The foo.log file will tell us what the script is doing. Last time I debugged this remotely, it turned out to be a user PATH problem ...

**Comment by o-smirnov** [comment]
But I don't see the exec command at all. Here's the fuller log:

```
  engine:ws received "421["fits2fits",{"sect":"256,256,1","fits":"/3C147-CD-LO-spw0-s7-lwimager.fullrest.fits","parent":true,"cookie":"_xsrf=2|89506d0f|3a80c841be4330ee255e237b763d1d24|1530023674","dataPath":"$HOME/Desktop:$HOME/data:.:/.../../"}]" +1s
  engine:socket packet +0ms
  socket.io-parser decoded 21["fits2fits",{"sect":"256,256,1","fits":"/3C147-CD-LO-spw0-s7-lwimager.fullrest.fits","parent":true,"cookie":"_xsrf=2|89506d0f|3a80c841be4330ee255e237b763d1d24|1530023674","dataPath":"$HOME/Desktop:$HOME/data:.:/.../../"}] as {"type":2,"nsp":"/","id":1,"data":["fits2fits",{"sect":"256,256,1","fits":"/3C147-CD-LO-spw0-s7-lwimager.fullrest.fits","parent":true,"cookie":"_xsrf=2|89506d0f|3a80c841be4330ee255e237b763d1d24|1530023674","dataPath":"$HOME/Desktop:$HOME/data:.:/.../../"}]} +0ms
  socket.io:socket got packet {"type":2,"nsp":"/","id":1,"data":["fits2fits",{"sect":"256,256,1","fits":"/3C147-CD-LO-spw0-s7-lwimager.fullrest.fits","parent":true,"cookie":"_xsrf=2|89506d0f|3a80c841be4330ee255e237b763d1d24|1530023674","dataPath":"$HOME/Desktop:$HOME/data:.:/.../../"}]} +0ms
  socket.io:socket emitting event ["fits2fits",{"sect":"256,256,1","fits":"/3C147-CD-LO-spw0-s7-lwimager.fullrest.fits","parent":true,"cookie":"_xsrf=2|89506d0f|3a80c841be4330ee255e237b763d1d24|1530023674","dataPath":"$HOME/Desktop:$HOME/data:.:/.../../"}] +0ms
  socket.io:socket attaching ack callback to event +0ms
  socket.io:socket dispatching an event ["fits2fits",{"sect":"256,256,1","fits":"/3C147-CD-LO-spw0-s7-lwimager.fullrest.fits","parent":true,"cookie":"_xsrf=2|89506d0f|3a80c841be4330ee255e237b763d1d24|1530023674","dataPath":"$HOME/Desktop:$HOME/data:.:/.../../"},null] +0ms
  socket.io:socket sending ack [{"stdout":"/3C147-CD-LO-spw0-s7-lwimager.fullrest.fits","stderr":null,"errcode":0,"encoding":"ascii"}] +1ms
  socket.io:client writing packet {"id":1,"type":3,"data":[{"stdout":"/3C147-CD-LO-spw0-s7-lwimager.fullrest.fits","stderr":null,"errcode":0,"encoding":"ascii"}],"nsp":"/"} +0ms
  socket.io-parser encoding packet {"id":1,"type":3,"data":[{"stdout":"/3C147-CD-LO-spw0-s7-lwimager.fullrest.fits","stderr":null,"errcode":0,"encoding":"ascii"}],"nsp":"/"} +0ms
  socket.io-parser encoded {"id":1,"type":3,"data":[{"stdout":"/3C147-CD-LO-spw0-s7-lwimager.fullrest.fits","stderr":null,"errcode":0,"encoding":"ascii"}],"nsp":"/"} as 31[{"stdout":"/3C147-CD-LO-spw0-s7-lwimager.fullrest.fits","stderr":null,"errcode":0,"encoding":"ascii"}] +0ms
  engine:socket sending packet "message" (31[{"stdout":"/3C147-CD-LO-spw0-s7-lwimager.fullrest.fits","stderr":null,"errcode":0,"encoding":"ascii"}]) +0ms
  engine:socket flushing buffer to transport +0ms
  engine:ws writing "431[{"stdout":"/3C147-CD-LO-spw0-s7-lwimager.fullrest.fits","stderr":null,"errcode":0,"encoding":"ascii"}]" +0ms
  engine:ws received "422["image",{"image":"/3C147-CD-LO-spw0-s7-lwimager.fullrest.fits","cookie":"_xsrf=2|89506d0f|3a80c841be4330ee255e237b763d1d24|1530023674","dataPath":"$HOME/Desktop:$HOME/data:.:/.../../"}]" +8s
  engine:socket packet +0ms
  socket.io-parser decoded 22["image",{"image":"/3C147-CD-LO-spw0-s7-lwimager.fullrest.fits","cookie":"_xsrf=2|89506d0f|3a80c841be4330ee255e237b763d1d24|1530023674","dataPath":"$HOME/Desktop:$HOME/data:.:/.../../"}] as {"type":2,"nsp":"/","id":2,"data":["image",{"image":"/3C147-CD-LO-spw0-s7-lwimager.fullrest.fits","cookie":"_xsrf=2|89506d0f|3a80c841be4330ee255e237b763d1d24|1530023674","dataPath":"$HOME/Desktop:$HOME/data:.:/.../../"}]} +0ms
  socket.io:socket got packet {"type":2,"nsp":"/","id":2,"data":["image",{"image":"/3C147-CD-LO-spw0-s7-lwimager.fullrest.fits","cookie":"_xsrf=2|89506d0f|3a80c841be4330ee255e237b763d1d24|1530023674","dataPath":"$HOME/Desktop:$HOME/data:.:/.../../"}]} +0ms
  socket.io:socket emitting event ["image",{"image":"/3C147-CD-LO-spw0-s7-lwimager.fullrest.fits","cookie":"_xsrf=2|89506d0f|3a80c841be4330ee255e237b763d1d24|1530023674","dataPath":"$HOME/Desktop:$HOME/data:.:/.../../"}] +0ms
  socket.io:socket attaching ack callback to event +0ms
  socket.io:socket dispatching an event ["image",{"image":"/3C147-CD-LO-spw0-s7-lwimager.fullrest.fits","cookie":"_xsrf=2|89506d0f|3a80c841be4330ee255e237b763d1d24|1530023674","dataPath":"$HOME/Desktop:$HOME/data:.:/.../../"},null] +0ms
  socket.io:socket sending ack [{"stdout":null,"stderr":null,"errcode":0,"encoding":"ascii"}] +1ms
  socket.io:client writing packet {"id":2,"type":3,"data":[{"stdout":null,"stderr":null,"errcode":0,"encoding":"ascii"}],"nsp":"/"} +0ms
  socket.io-parser encoding packet {"id":2,"type":3,"data":[{"stdout":null,"stderr":null,"errcode":0,"encoding":"ascii"}],"nsp":"/"} +0ms
  socket.io-parser encoded {"id":2,"type":3,"data":[{"stdout":null,"stderr":null,"errcode":0,"encoding":"ascii"}],"nsp":"/"} as 32[{"stdout":null,"stderr":null,"errcode":0,"encoding":"ascii"}] +0ms
  engine:socket sending packet "message" (32[{"stdout":null,"stderr":null,"errcode":0,"encoding":"ascii"}]) +0ms
  engine:socket flushing buffer to transport +0ms
  engine:ws writing "432[{"stdout":null,"stderr":null,"errcode":0,"encoding":"ascii"}]" +0ms
```

**Comment by o-smirnov** [comment]
BTW, this is bypassing Tornado again and just using SimpleHTTPServer. (I've ran into more Tornado problems, on which I'll comment on the other thread...)

**Comment by ericmandel** [comment]
Sorry, I'm talking about the console output from the node command itself:
````
node js9Helper.js
````
The question is whether node got the imsection command and exec'ed the script to process  it.
It looks like node decided not to exec the imsection command, and that would be good to know.

**Comment by o-smirnov** [comment]
No, the node is definitely not exec'ing the imsection command... (The log above is from running ``DEBUG='*' nodejs js9Helper.js``, so it contains both the packet log and the console output).

Funnily enough, in the "Analysis" menu, I have the "upload FITS to make tasks available" option, which I can click on, to which the node responds with:

```
exec: /home/oms/radiopadre/js9-www/analysis-wrappers/js9Xeq [quotacheck]  [2018-7-5 16:14:42]
exec: /home/oms/radiopadre/js9-www/analysis-wrappers/js9Xeq [uploadfits,__3C147-CD-LO-spw0-s7-lwimager.fullrest.fits]  [2018-7-5 16:14:43]
```

...and then an upload commences, and server-side analysis becomes available. But this is kind of perverse: the FITS file starts out server-side, the browser downloaded it, and now it's sent it back to the server....

But the ``js9Xeq`` script is definitely there and working. It's just not getting executed when the initial image is loaded...

**Comment by ericmandel** [comment]
Well, node looks for the FITS file and if it cannot find it, it lets the client deal with file:
````
	myenv.JS9_DATAPATH = getDataPath(obj.dataPath);
	s = getFilePath(obj.fits, myenv.JS9_DATAPATH, myenv);
	if( !s ){
	    // did not find file, let js9 take care of it
	    if( cbfunc ){
		res.stdout = obj.fits;
		cbfunc(res);
	    }
	    return;
````
Where is this data file located relative to the JS9 install directory?
````
"fits":"/3C147-CD-LO-spw0-s7-lwimager.fullrest.fits"
````
Probably node did not find the data file ... which might be due to confusion on my part about where to look and what the paths mean ...

**Comment by ericmandel** [comment]
No, you definitely should not have to upload the FITS file. But what is happening is that the uploaded file is being stored in a place the helper can find easily.

**Comment by ericmandel** [comment]
So you could try removing the initial "/" from the path of the FITS file ...

**Comment by o-smirnov** [comment]
> Where is this data file located relative to the JS9 install directory?

Bingo, that's exactly the problem. If I take the leading slash off the file name, things start to work.

So I see where the confusion arises, I'm just not quite sure how to work it out properly yet. Let's say the FITS file lives in ``~/data``. When I start Jupyter (and SimpleHTTPServer) under ``~/data``, they interpret the URLs the browser asks for relative to that directory. To them, the leading slash actually means ``~/data``. But obviously not to the helper (which I also run under ``~/data`` in this instance).

**Comment by ericmandel** [comment]
Yes, this has caused me endless confusion and obviously I don't have it right yet. So I suggest leaving the "/" prefix off for now, and I'll look into it ... once again.

The problem is that the web page is not always in the same location as the node server, and I try really hard to correct the path relative to node -- when node is processing that data file.

**Comment by o-smirnov** [comment]
OK, without the slash I get into a new problem. Playing with the Bin/Filter/Section plugin, I quickly break it with:

![image](https://user-images.githubusercontent.com/6470079/42329875-16501228-8072-11e8-9da8-c62aec567aab.png)

And the corresponding console line:

```
exec: /home/oms/radiopadre/js9-www/analysis-wrappers/js9Xeq [imsection,/home/oms/radiopadre/js9-www/3C147-CD-LO-spw0-s7-lwimager.fullrest.fits,256@2047,256@2047,1,,]  [2018-7-5 16:38:35]
```

In this case, `` /home/oms/radiopadre/js9-www/`` is my JS9 web install dir. So obviously it's gotten prepended to the filename somewhere along the line.

**Comment by ericmandel** [comment]
Hmmm ... this might be a simple bug in js9Helper.js, in which it is processing "/" differently from the browser. Can you please make the change below in js9Helper.js, go back to using "/" as a prefix, and let me know if it works? If it does (and it should), I have to make a bunch of tests before updating.

<img width="641" alt="screen shot 2018-07-05 at 10 52 40 am" src="https://user-images.githubusercontent.com/3028875/42330751-cab87e84-8041-11e8-9c2e-0190f7e44c99.png">

**Comment by ericmandel** [comment]
> exec: /home/oms/radiopadre/js9-www/analysis-wrappers/js9Xeq [imsection,/home/oms/radiopadre/js9-www/3C147-CD-LO-spw0-s7-lwimager.fullrest.fits,256@2047,256@2047,1,,]  [2018-7-5 16:38:35]

What is the actual directory in which the FITS file resides? Is it /home/oms/data?

**Comment by o-smirnov** [comment]
> What is the actual directory in which the FITS file resides? Is it /home/oms/data?

``/home/oms/RP-3C147``. Where I speak of ``~/data`` above, I mean ``~/RP-3C147``. (Sorry -- I should've used the correct name to begin with to avoid confusion.)

I'll try your patch momentarily.

**Comment by ericmandel** [comment]
>  To them, the leading slash actually means ~/data. But obviously not to the helper (which I also run under ~/data in this instance).

and:

> In this case, /home/oms/radiopadre/js9-www/ is my JS9 web install dir. So obviously it's gotten prepended to the filename somewhere along the line.

The helper should be running in the js9 install directory, where the node_modules reside. Is that not the case here? I'm confused ...

**Comment by o-smirnov** [comment]
With the patch, and with a leading slash, I'm getting a "Can't find FITS file '3C147-CD-LO-spw0-s7-lwimager.fullrest.fits'" dialog.

I'm pretty sure the problem is, the helper is not even looking in the directory that I originally run it in (``~/RP-3C147``). 

> The helper should be running in the js9 install directory, where the node_modules reside. Is that not the case here? I'm confused ...

No, I'm launching it in ``~/RP-3C147``, where the FITS files reside:

```
oms@jakob:~/RP-3C147$ nodejs ~/radiopadre/js9-www/js9Helper.js 
```

I guess I'm trying to use it in a way that you haven't intended! Is it the case that the helper figures out where it's been installed and chdirs into there before doing anything else? If that's the case, I understand why it's not working...

**Comment by ericmandel** [comment]
Yes, JS9 figures out the path from the web page to the js9 install dir, where it is assumed that the helper is running. It uses this info to fix up the paths of the data files when they are processed by the helper (since they are specified relative to the web page).

Let me think about this for a bit. We should be able to make it work.

**Comment by ericmandel** [comment]
But before I tear JS9 apart, could you please try this patch  of js9Helper.js? I see that the previous patch did not quite handle the "/" properly:

<img width="650" alt="screen shot 2018-07-05 at 11 33 29 am" src="https://user-images.githubusercontent.com/3028875/42332991-792621c4-8047-11e8-8279-a88d6d2cb362.png">

**Comment by o-smirnov** [comment]
Yep, exactly. If I add ``$HOME/RP-3C147`` to globalOpts.dataDir in ``js9Prefs.json``, the helper is able to find my FITS files again (with a leading slash in the name, and with your patch in place).

I think we're running into philosophical differences here. You designed it for the scenario of a single webserver and a single helper process serving multiple users, correct? Whereas in the Jupyter use case, each user essentially runs their own private Tornado webserver (or even multiple Tornado servers, if they launch multiple notebooks in different directories). This does not align well with the "single global JS9 install" philosophy.

(The discussion in https://github.com/ericmandel/js9/issues/38#issuecomment-402518900 is related to this -- I wanted per-user helper processes for similar reasons...)

In principle I can work around this by generating a custom ``js9Prefs.json`` on-the-fly per each Jupyter session, setting up a fake custom JS9 install dir, etc... Very kludgy... it would be easier if you could either:

* add a command-line option to the helper to specify an additional dataDir on-the-fly

* have the helper look in the directory it was started in

For full Jupyter integration, there's going to be an additional problem. If I start a notebook under ``~/x/``, then in Tornado, the file ``~/x/y/z.fits`` is actually ``http://localhost:8888/files/y/z.fits``. So the helper would have to engage in some URL rewriting: if the browser is trying to load ``/files/y/z.fits``, it should know to look at ``~/x/y/z.fits``.

**Comment by o-smirnov** [comment]
> But before I tear JS9 apart, could you please try this patch of js9Helper.js?

Tried it. Still getting the "Can't find FITS file" dialog...

```
exec: /home/oms/radiopadre/js9-www/analysis-wrappers/js9Xeq [imsection,-parent,3C147-CD-LO-spw0-s9-lwimager.fullrest.fits,2048,2048,2]  [2018-7-5 17:44:49]
```

**Comment by ericmandel** [comment]
> have the helper look in the directory it was started in

I thought that is what the latest patch accomplished by adding "." to the list of data directories. But then why does this not work:

> exec: /home/oms/radiopadre/js9-www/analysis-wrappers/js9Xeq [imsection,-parent,3C147-CD-LO-spw0-s9-lwimager.fullrest.fits,2048,2048,2]  [2018-7-5 17:44:49]

Isn't the FITS file in the same directory from which nodejs was started?

**Comment by o-smirnov** [comment]
> Isn't the FITS file in the same directory from which nodejs was started?

It most certainly is. :( Silly question, but how do make it print to the console? I could add some print statements to that code...

**Comment by ericmandel** [comment]
Console.log should work ... unless we have reached that point where nothing seems to work!

So:
````
console.log("trying: %s", parr[i])
````

**Comment by o-smirnov** [comment]
Aha, so I also added a log statement inside the if... and I see: 
```
Trying 3C147-CD-LO-spw0-s7-lwimager.fullrest.fits
Found 3C147-CD-LO-spw0-s7-lwimager.fullrest.fits
exec: /home/oms/radiopadre/js9-www/analysis-wrappers/js9Xeq [imsection,-parent,3C147-CD-LO-spw0-s7-lwimager.fullrest.fits,2048,2048,2]  [2018-7-5 19:30:51]
```
So the helper finds the FITS file fine at that point. It's something down the line that causes the error...

**Comment by o-smirnov** [comment]
OK, I see the problem. It's in ``js9Xeq``. Looks like it cd's into the output directory:

```
/home/oms/radiopadre/js9-www/.radiopadre/ecf792de-0a5a-446e-a27a-1c186214461d
```

Then runs 

```
js9helper -i 3C147-CD-LO-spw0-s7-lwimager.fullrest.fits imsection \!3C147-CD-LO-spw0-s7-lwimager.fullrest_2048_2048_2.fits.gz 2048,2048,2
```

So I guess you just need to invoke it with an absolute path to the original FITS file in this case (which would have happened anyway if the file was located in a dataDir...)

**Comment by ericmandel** [comment]
I was just about to get to the same place ...

I need to set up a similar situation, with the helper running in the data directory. Let me do that and make some changes to facilitate that sort of processing and I'll be back ...

**Comment by o-smirnov** [comment]
By the way, is there cube support for fits2fits?

**Comment by ericmandel** [comment]
Not until you tell me what you need ... presumably you want to extract the same binned section of each slice and then recombine into a cube?

**Comment by o-smirnov** [comment]
To first order, yes... bearing in mind that this can be a 4D cube.

...And then at some point we'll get into Terabyte cube territory, in which case we'll need to slice the axes somehow (i.e. take a subset of the frequency channels, etc.) But let's worry about that later...

**Comment by ericmandel** [comment]
This may be a subject amenable to code contributions ... js9helper is just a CFITSIO program in C ...

**Comment by ericmandel** [comment]
>  So  I guess you just need to invoke it with an absolute path to the  original FITS file in this case (which would have happened anyway if the  file was located in a dataDir...)

As it turns out, this was the worst of the problems, since a lot of work had already been done on the helper to split the install directory and the current runtime directory, in support of Desktop JS9 (very nice, uses Electron.js). So I have been running a helper in a different directory for a few hours and things seems to work pretty well.

There are some interesting globalOpts properties (moved from analOpts) to highlight:
````
globalOpts.prependJS9Dir: true,        // prepend $JS9_DIR to relative fitsFile paths?
dataDir: null,                                       // use as path to FITS data (use incoming path if this is not set)
````
I didn't seem to need them in my testing but they are there for when your use case turns out to be different from mine ...

> add a command-line option to the helper to specify an additional dataDir on-the-fly

I implemented this by supporting the ability to supply as a command-line argument, a JSON string detailing globalOpts you wish to add to node, e.g.:
````
node js9Helper.js '{"dataPath":"/Users/eric/tmp:/data"}'
````
All is updated in GitHub, so if you pull it over, we can start fixing the bugs related to your unexpected uses ....

**Comment by o-smirnov** [comment]
OK, so I've pulled in your latest changes... and gone back to using SimpleHTTPServer after that brief flicker of hope in #6. So Jupyter is completely out of the picture for now, for the purposes of this discussion.

Now, I have two HTML documents, both identical except for one line which either says

```
JS9.Load("/./3C147-CD-LO-spw0-s7-lwimager.fullrest.fits", {fits2fits:false})
```

or

```
JS9.Load("/./3C147-CD-LO-spw0-s7-lwimager.fullrest.fits",{fits2fits:true,xcen:2048,ycen:1024,xdim:256,ydim:256,bin:4})
```

The first one loads fine. The second one throws a "no FITS module available to process FITS file" error. 

In the second case, I can see the helper being invoked:

```
exec: /home/oms/.radiopadre-venv/js9-www/analysis-wrappers/js9Xeq [imsection,-parent,/home/oms/RP-3C147/3C147-CD-LO-spw0-s7-lwimager.fullrest.fits,256@2048,256@1024,4]  [2018-7-6 14:33:16]
```

...and I can see an HTTP request for the generated representation file:

```
localhost ssh: 127.0.0.1 - - [06/Jul/2018 14:33:17] "GET /.radiopadre/js9-www/.radiopadre/80cb65be-3a87-40ff-9b7a-3414af374209/3C147-CD-LO-spw0-s7-lwimager.fullrest_256_2048_256_1024_4.fits.gz?r=0.3971156191659666 HTTP/1.1" 200 -
```

**Comment by ericmandel** [comment]
That makes no sense to me whatsoever ... not that I don't believe you, but it makes no sense.

Here is the code that throws the error:
````
JS9.handleFITSFile = function(file, opts, handler){
    if( JS9.fits.handleFITSFile ){
	JS9.fits.handleFITSFile(file, opts, handler);
    } else {
	JS9.error("no FITS module available to process FITS file");
    }
};
````
That routine gets used in both cases mentioned above. You can print the property out at any time in the JavaScript console, i.e. before and after the load:
````
JS9.fits.handleFITSFile
````
Does it exist in the fits2fits case before the load is performed?

**Comment by o-smirnov** [comment]
> That routine gets used in both cases mentioned above

OK, it's not a difference between the two cases, it's a matter of dumb luck (or the order in which things are loaded perhaps, as you imply in the other thread -- but there's no Jupyter involved here). I added console statements:

```
        console.log("handler before:"+JS9.fits.handleFITSFile);
		JS9.Load("/./3C147-CD-LO-spw0-s9-lwimager.fullrest.fits", {fits2fits:false})
        console.log("handler after:"+JS9.fits.handleFITSFile);
```

And it always comes back with "undefined". But if I click reload enough times, eventually it succeeds with the loading, with this on the console:

![image](https://user-images.githubusercontent.com/6470079/42380303-b2f2b584-812d-11e8-9e0d-b660a746073f.png)

So I guess the FITS handler doesn't initialize immediately -- but every now and then, it manages to do it before the file arrives?

**Comment by ericmandel** [comment]
How and when are you calling JS9.Load()? You can't call JS9.Load() until JS9 is ready (so you can't call it in an onload). You can call JS9.Preload() any time, and it will wait until JS9 is ready. Or you can check for JS9 being ready itself and call JS9.Load (I think):
````
    $(document).on("JS9:ready", function(){
        JS9.Load("/./3C147-CD-LO-spw0-s7-lwimager.fullrest.fits",{fits2fits:true,xcen:2048,ycen:1024,xdim:256,ydim:256,bin:4})
    });
````

**Comment by o-smirnov** [comment]
After a timeout. A hack I inherited from @gijzelaerr, who didn't know about Preload() I'm guessing. Let me try the latter.

```
    <script type="text/javascript">
      $(document).ready(function(){
          $("#centerdiv").draggable({
            handle: "#JS9Menubar",
            opacity: 0.35
          });
      });
      setTimeout(function loadIm(){
        console.log("handler before:"+JS9.fits.handleFITSFile);
		JS9.Load("/./3C147-CD-LO-spw0-s9-lwimager.fullrest.fits", {fits2fits:true,xcen:2048,ycen:1024,xdim:256,ydim:256,bin:4})
        console.log("handler after:"+JS9.fits.handleFITSFile);
      },2000);
    </script>
```

**Comment by ericmandel** [comment]
I'd strongly recommend putting the JS9.PreLoad() call into the $(document).ready function. As things stand, I believe JS9.PreLoad() will get called immediately when that script tags gets executed, and it's unclear to me whether JS9 is guaranteed to be loaded (let alone initialized).

**Comment by o-smirnov** [comment]
Excellent! Doing the Preload() has solved all these problems.

Now there's a new one, stay tuned...

**Comment by o-smirnov** [comment]
OK, this is maybe just me misunderstanding things. So I'm preloading the image as

```
JS9.Preload("/./combined-4M5S-robust0_5.fits",{fits2fits:true,xcen:2048,ycen:1024,xdim:256,ydim:256,bin:4})
```

So I see a little 64x64 cutout as expected:

![image](https://user-images.githubusercontent.com/6470079/42382099-88e08c5c-8133-11e8-8e5e-359cdd1bcf66.png)

But if I click "Load full image", I get an even **smaller** cutout instead:

![image](https://user-images.githubusercontent.com/6470079/42382223-f3a501ee-8133-11e8-8e06-c60b62a0d949.png)

And if I keep clicking, it gets smaller and smaller, until I get the error:

```
ERROR from cfitsio.js: illegal axis length < 1
```

**Comment by ericmandel** [comment]
That's a bug!

**Comment by ericmandel** [comment]
For next week: I'm having trouble reproducing this problem. Using my large Hubble test image and your preload parameters, I get the expected 64x64 image initially:

<img width="1027" alt="before" src="https://user-images.githubusercontent.com/3028875/42410836-b93943c2-81be-11e8-8697-b418f946814b.png">

And on loading the full image, I get what I expect. Could I please get a copy of your FITS file to test directly?

<img width="1009" alt="after" src="https://user-images.githubusercontent.com/3028875/42410908-f8311874-81bf-11e8-888d-f19ff07df291.png">

**Comment by o-smirnov** [comment]
Here's a link to the image:

https://www.dropbox.com/s/2d5ggbg485gd7ip/combined-4M5S-robust0_5.fits?dl=0

I suspect the presence of a STOKES axis makes a difference...

**Comment by ericmandel** [comment]
Thanks, I'll probably look into this today, my easy Sunday afternoon project turns out to be not easy ...

**Comment by ericmandel** [comment]
Rats, it still works for me with your data file:

<img width="1023" alt="screen shot 2018-07-08 at 11 49 10 am" src="https://user-images.githubusercontent.com/3028875/42421529-ff219006-82a4-11e8-825e-a928b2b0eabc.png">

<img width="964" alt="screen shot 2018-07-08 at 11 50 36 am" src="https://user-images.githubusercontent.com/3028875/42421539-26d70d10-82a5-11e8-8a00-70c12a072998.png">

Here is my debug.html (renamed to debug.txt to make GitHub happy), perhaps on Monday you can fiddle the pathnames and see if it works for you. Obviously, there is some difference ...

[debug.txt](https://github.com/gijzelaerr/js9notebook/files/2173876/debug.txt)

**Comment by ericmandel** [comment]
Never mind! I forgot that I was running without a helper at all, so all of my tests were using the internal imsection code. I've reproduced the problem and will fix it in the next day or so.

**Comment by ericmandel** [comment]
OK, this turned out to be caused by having double-quote characters in some HISTORY comments, which caused a JSON parser to fail. All fixed and updated in GitHub.

**Comment by o-smirnov** [comment]
That's odd, I'm getting what looks to be a cfitsio-related linker error now:
```
gcc  js9helper.o jsfitsio.o listhdu.o healpix.o -o js9helper libutil.a -L /usr/lib/x86_64-linux-gnu -lcfitsio    -ldl -lm
jsfitsio.o: In function `filterTableToImage':
/home/oms/radiopadre/js9/astroem/jsfitsio/jsfitsio.c:827: undefined reference to `ffhist3'
collect2: error: ld returned 1 exit status
Makefile:266: recipe for target 'js9helper' failed
```
Has anything changed in the .c code?

**Comment by ericmandel** [comment]
I changed js9helper.c to fix the bug in displaying the full image, whereas ffhist3() is called in astroem/js9fitsio/jsfitsio.c. I built the changed code under OSX and Linux ... but ...

... the ffhist3() routine was added to cfitsio (at my request, big mistake) in cfitsio v3.39. There is logic in jsfitsio.c to determine whether to use the version internal to jsfitsio.c or the cfitsio version:
````
// this routine was added to cfitsio v3.39
#if (CFITSIO_MAJOR < 3) || ((CFITSIO_MAJOR == 3) && (CFITSIO_MINOR < 39))
// ffhist3: same as ffhist2, but does not close the original file,
// and/or replace the original file pointer
fitsfile *ffhist3(fitsfile *fptr, /* I - ptr to table with X and Y cols*/
````
So, for example, if you #include updated 3.4x cfitsio library headers but link against a pre-3.4x library, you will get that error.

**Comment by o-smirnov** [comment]
Ah, thanks -- indeed I'd forgotten that I had a newer version of cfitsio installed under ``/usr/local`` (from when before you fixed configure to find the system-wide one under ``/usr``), and this was interfering. Builds fine now.

**Comment by ericmandel** [comment]
Sigh ... if only I hadn't talked to the CFITSIO developers about what I was doing, this would never have happened!

**Comment by o-smirnov** [comment]
No big deal. Newer Ubuntus won't have this problem anyway -- my system is due for an update.

I confirm it works for me now. There's one wrinkle remaining, when I preload the (4096x4096 original size) image like this:

```
JS9.Preload("http://localhost:1026/./combined-4M5S-robust0_5.fits", {fits2fits:true,xcen:2048,ycen:2048,xdim:1024,ydim:1024,bin:1});
```

...it starts up off-centre: 

![image](https://user-images.githubusercontent.com/6470079/42536804-5b1ffa92-8493-11e8-9261-ab9a056fa813.png)

Doesn't affect the functionality at all, just a little puzzling. Maybe the initial centre coordinates are computed based on the original image size?

**Comment by ericmandel** [comment]
Hmmm ... weird ... when I do it:
````
JS9.Preload("../Desktop/combined-4M5S-robust0_5.fits",{fits2fits:"always",xcen:2048,ycen:2048,xdim:1024,ydim:1024,bin:1})
````
I get something that (I believe) is centered:

<img width="889" alt="screen shot 2018-07-10 at 5 08 38 pm" src="https://user-images.githubusercontent.com/3028875/42537826-fb41df84-8463-11e8-8667-2fee0073d78f.png">

So I'm a little stumped ... unless you have an onload function defined somewhere that pans??

**Comment by o-smirnov** [comment]
> I get something that (I believe) is centered:

Yours does looks centred...

> So I'm a little stumped ... unless you have an onload function defined somewhere that pans??

Can't be -- that's still beyond my capabilities for now!

I do get this even outside Jupyter, with a simple webpage that looks like this: https://gist.github.com/o-smirnov/99d52549e2b6ad45019ae089bd94b9d5

Anyway, this more of an annoyance than a bug, so let's not lose too much sleep over it. Speaking of which, I'm signing out until tomorrow -- thanks for the help again!

**Comment by ericmandel** [comment]
I'll think more on this, I'd like to get things working perfectly.

**Comment by o-smirnov** [comment]
Coming back to this, unfortunately... I thought I has this kicked, but I'm still having trouble connecting to the helper in some scenarios. I'm trying to use ssh tunneling to connect to a helper on a remote machine. This isn't quite working. 

So I have the helper running on machine ``stills``, port 1025. I have an ssh session to stills open with ``-L localhost:11001:localhost:1025``.  So a connection to locahost:11001 gets forwarded to the helper port 1025 on stills. I have helperPort set to 11001 on the client.

But things don't work. JS console says:

```
JS9 helper connect error: timeout (or connection refused)
```

Helper console says nothing, but if I run it with ``DEBUG='*'``, I do see these message every time I load the client:

```
  socket.io:server serve client source +27s
  socket.io:server serve client 304 +1s
```

So it's doing *something* to the helper at least -- just not working fully.

**Comment by ericmandel** [comment]
Hmmm ... XMM is also trying to do port forwarding this week. What's going on?

From what I can tell, you have to do a bit more than just forward the traffic. I think you need to change things a bit once the connection has upgraded to websockets.

See:  https://github.com/socketio/socket.io/issues/1696

With an Apache server, the recommendation is to use rewrite as well as a port forwarding. Not sure about a Python server:
````
RewriteEngine On
RewriteCond %{REQUEST_URI}  ^/socket.io/1/websocket  [NC]
RewriteRule /(.*)           ws://localhost:3000/$1 [P,L]

ProxyPass        /socket.io http://localhost:3000/socket.io
ProxyPassReverse /socket.io http://localhost:3000/socket.io
````

The alternative is not use use websocket at all, just stick with long polling, but have a look at this first ...

**Comment by o-smirnov** [comment]
Sigh. That just sailed so far over my head, air traffic control needed to be alerted...

Pretty sure URL rewriting is not supported by Tornado though.

**Comment by ericmandel** [comment]
OK, sorry, let me look around for a more concrete configuration suggestion to make, at least for experimentation purposes ... have to leave my computer for an hour so it won't be immediate ...

**Comment by ericmandel** [comment]
Let's see if we can get lucky with Tornado, for once ... Try turning off websocket support in the helper and using http long polling instead. You can do this by supplying the following command line option:
````
node js9Helper '{"helperOpts":{"transports":["polling"],"maxHttpBufferSize": 10E9}}'
````
This tells socket.io to stick with the slower fallback long-polling communication method and not upgrade to websockets. It should work through port-forwarding without a rewrite. If so, you can start with this and try to unravel this alternative to rewrite in Python:

https://stackoverflow.com/questions/18624251/is-there-an-alternative-of-rewriterule-htaccess-for-a-python-http-server-http

**Comment by o-smirnov** [comment]
> You can do this by supplying the following command line option:

I tried this, but the problem persists, sadly...

**Comment by ericmandel** [comment]
That's too bad, but it was a long shot ... let me fiddle around here and see if I can connect through an ssh proxy port.

**Comment by o-smirnov** [comment]
Hang on, does the websocket use a different port from the helper yet again?
If so, I may have to forward that too...

**Comment by ericmandel** [comment]
No, sorry, I think it does use 2718.

Have you tried doing this all on localhost, still using the ssh proxy from/to localhost? I do see the problem when ssh is going to another host, and I was about to try localhost, to see if anything works ...

**Comment by o-smirnov** [comment]
It works locally. Which is why I suspected another port coming into play...

**Comment by ericmandel** [comment]
It works locally for me as well. Let me poke around, we're a bit in the weeds now ...

**Comment by ericmandel** [comment]
So I am using this simpler command as a test:
````
wget localhost:2719
````
where 2719 is port forwarding to port 2718 on a machine called "oldakela" (and 2718 is the usual helper port) and I definitely get "connection refused" errors.

The firewall is off on the oldakela, so I don't understand the error. I'm going to replace the js9helper with something else ...

Here is my setup script to proxy to oldakela:
````
#!/bin/bash
# set -x

XHOST="oldakela.local"
XPORT=2719

got=`ps guwax | grep -i "$XPORT:$XHOST" | grep -v grep | awk '{print $2" "$8}'`

if [ x"$got" = x ]; then
  echo "starting ssh tunnel port 2718 for ssh ..."
  ssh -N -f -L $XPORT:$XHOST:2718 eric@oldakela.local
else
  echo "ssh tunnel already exists: $got"
fi
````

**Comment by ericmandel** [comment]
Wait, wait ... the ssh port forwarding works perfectly here between two Macs, using the script shown above to set up the port forwarding. (Re the error above: I didn't have node installed on oldakela, so there was no process listening on port 2718 initially). I can load a JS9 page on my development Mac with the helper port set to 2719, and I can see the connection being accepted by the js9 helper on oldakala at port 2718, with the usual output.

So ... it looks like it can work. What is the difference between our setups?

**Comment by ericmandel** [comment]
I have the feeling that a timeout (I make up the "connection refused" message) is not at the helper level, but at the firewall level. Can you access port 2718 on stills directly from another host, using for example, wget?

**Comment by o-smirnov** [comment]
But surely the firewall shouldn't enter into it if I'm tunneling through ssh... in fact that's the whole point of tunneling?

So I have the helper listening on port 1025 on stills:

```
oms@stills$ ps ax| grep js9
  7820 pts/25   Sl+    0:00 /usr/bin/nodejs /home/oms/.radiopadre-venv/js9-www/js9Helper.js {"helperPort": 1025, "helperOpts":{"transports":["polling"],"maxHttpBufferSize": 10E9}}
```

And I have an ssh tunnel open from my laptop, forwarding local port 11001 to 1025 on stills:

```
oms@jakob:~$ ps ax|grep ssh
...
27011 pts/5    S+     0:00 ssh -tt -o ControlMaster=auto -o ControlPersist=1h -o ControlPath=/tmp/ssh_mux_%C stills -L localhost:11000:localhost:1024 -L localhost:11001:localhost:1025 -L localhost:11002:localhost:1026 cat >/dev/null
```
And I can actually talk to the helper on stills by connecting to local port 11001:
```
oms@jakob:~$ wget http://localhost:11001/socket.io/socket.io.js
--2018-08-01 11:14:05--  http://localhost:11001/socket.io/socket.io.js
Resolving localhost (localhost)... 127.0.0.1
Connecting to localhost (localhost)|127.0.0.1|:11001... connected.
HTTP request sent, awaiting response... 200 OK
Length: unspecified [application/javascript]
Saving to: ‘socket.io.js’

socket.io.js                                  [ <=>                                                                               ]  60.97K  --.-KB/s    in 0.001s  

2018-08-01 11:14:07 (74.2 MB/s) - ‘socket.io.js’ saved [62438]
```
And I've got JS9 configured to connect to port 11001:

![image](https://user-images.githubusercontent.com/6470079/43512233-cfe9ebc4-957a-11e8-89dd-07baa5563131.png)

And yet I still get the connection error.

But wait! It gets weirder. If I reload the web page enough times, every now and then it **will** connect. So it's some kind of timing issue, perhaps?

**Comment by o-smirnov** [comment]
I'm happy to poke around, inserting ``console.log()`` messages where appropriate, if you'll teach me where. Must I load js9.js instead of js9.min.js if I start inserting debug messages?

**Comment by ericmandel** [comment]
> But surely the firewall shouldn't enter into it if I'm tunneling through ssh... in fact that's the whole point of tunneling?

All I'm saying is that, in my experience, timeout errors are caused by problems with the connection (including the listener not actually listening, as when I was not actually running the helper). As if the ssh tunnel command is not setting things up properly.

And ... I can't get your ssh tunnel command to work, I get an error:
````
mux_client_forward: forwarding request failed: Port forwarding failed
muxclient: master forward request failed
````
Probably that is a Linux/Mac discrepancy? I can get this command line to work:
````
ssh -N -f -L localhost:2717:localhost:2718 oldakela.local
````
Can you try those command switches instead?

**Comment by ericmandel** [comment]
Might want to remove -f (go into background) from the command line and add -vvv (verbose debugging) ...

**Comment by ericmandel** [comment]
FYI, I can port-forward successfully Mac to Mac, but not Mac to Linux. My script below works when forwarding to oldakela, but not to the main js9 web site. And although there is an additional nuance when going to the js9 site having to do with our LAN security setup, I think it ought to work. So ... we now both agree that something is wrong ... I'll fiddle around ...
````
#!/bin/bash

# ssh -tt -o ControlMaster=auto -o ControlPersist=1h -o ControlPath=/tmp/ssh_mux_%C oldakela.local -L localhost:2719:oldakela.local:2718 
# ssh -N -f -L localhost:2717:localhost:2718 oldakela.local
# ssh -N -f -L localhost:2717:js9.si.edu:2718 eric@xxx.cfa.harvard.edu

XLOCAL="localhost:2717"
# XREMOTE="oldakela.local:2718"
# XPROXY="eric@oldakela.local"
XREMOTE="js9.si.edu:2718"
XPROXY=eric@xxx.cfa.harvard.edu

got=`ps guwax | grep -i "$XREMOTE" | grep -v grep | awk '{print $2" "$8}'`

if [ x"$got" = x ]; then
  echo "starting ssh tunnel for $XREMOTE ..."
  ssh -X -N -f -L $XLOCAL:$XREMOTE $XPROXY
else
  echo "ssh tunnel already exists: $got"
fi
````

**Comment by ericmandel** [comment]
I'm using tcpdump to look at the packet coming being sent from one machine and received on the other  machine. On the working Mac to Mac connection, I see the same packets go out  from one and come in to the other, as expected.

Here are packets leaving the client machine:
````
eric% sudo tcpdump -c 20 -i any dst 10.0.1.11
tcpdump: data link type PKTAP
tcpdump: verbose output suppressed, use -v or -vv for full protocol decode
listening on any, link-type PKTAP (Apple DLT_PKTAP), capture size 262144 bytes
13:24:53.739098 IP 10.0.1.6.53485 > 10.0.1.11.ssh: Flags [P.], seq 347943380:347943424, ack 2579231154, win 4096, options [nop,nop,TS val 1442647939 ecr 488936650], length 44
13:24:53.739263 IP 10.0.1.6.53485 > 10.0.1.11.ssh: Flags [P.], seq 44:80, ack 1, win 4096, options [nop,nop,TS val 1442647939 ecr 488936650], length 36
13:24:53.920196 IP 10.0.1.6.53485 > 10.0.1.11.ssh: Flags [P.], seq 0:80, ack 1, win 4096, options [nop,nop,TS val 1442648120 ecr 488936650], length 80
13:24:53.964387 IP 10.0.1.6.53485 > 10.0.1.11.ssh: Flags [.], ack 45, win 4094, options [nop,nop,TS val 1442648163 ecr 488952220], length 0
````
Note the lengths of the packets. Here are those same packets being received by the other Mac:
````
sudo tcpdump -c 20 -i any src 10.0.1.6
tcpdump: data link type PKTAP
tcpdump: verbose output suppressed, use -v or -vv for full protocol decode
listening on any, link-type PKTAP (Apple DLT_PKTAP), capture size 262144 bytes
13:24:54.002484 IP 10.0.1.6.53485 > 10.0.1.11.ssh: Flags [P.], seq 347943380:347943424, ack 2579231154, win 4096, options [nop,nop,TS val 1442647939 ecr 488936650], length 44
13:24:54.002747 IP 10.0.1.6.53485 > 10.0.1.11.ssh: Flags [P.], seq 44:80, ack 1, win 4096, options [nop,nop,TS val 1442647939 ecr 488936650], length 36
13:24:54.002864 IP 10.0.1.6.53485 > 10.0.1.11.ssh: Flags [P.], seq 0:80, ack 1, win 4096, options [nop,nop,TS val 1442648120 ecr 488936650], length 80
13:24:54.006492 IP 10.0.1.6.53485 > 10.0.1.11.ssh: Flags [.], ack 45, win 4094, options [nop,nop,TS val 1442648163 ecr 488952220], length 0
````
You can see the received packet length is the same for these three packets.

For the non-working Mac to Linux situation, here are the packets going out:
````
sudo tcpdump -c 20 -i any dst 131.142.198.xxx
tcpdump: data link type PKTAP
tcpdump: verbose output suppressed, use -v or -vv for full protocol decode
listening on any, link-type PKTAP (Apple DLT_PKTAP), capture size 262144 bytes
13:14:49.318013 IP 10.161.0.54.52883 > xxx.cfa.harvard.edu.ssh: Flags [P.], seq 2321783938:2321783978, ack 1884083785, win 6231, options [nop,nop,TS val 1442044416 ecr 2676665659], length 40
13:14:49.369340 IP 10.161.0.54.52883 > xxx.cfa.harvard.edu.ssh: Flags [.], ack 89, win 6228, options [nop,nop,TS val 1442044466 ecr 2676860694], length 0
13:14:49.533144 IP 10.161.0.54.52883 > xxx.cfa.harvard.edu.ssh: Flags [P.], seq 40:80, ack 89, win 6231, options [nop,nop,TS val 1442044629 ecr 2676860694], length 40
13:14:49.583587 IP 10.161.0.54.52883 > xxx.cfa.harvard.edu.ssh: Flags [.], ack 145, win 6229, options [nop,nop,TS val 1442044679 ecr 2676860909], length 0
````
Two have non-zero length. And yikes, here are the packets being received. Note that all of these packets have length 0!!
````
[root@smartx soft]# tcpdump -c 20 -i any src 131.142.198.xxx
tcpdump: verbose output suppressed, use -v or -vv for full protocol decode
listening on any, link-type LINUX_SLL (Linux cooked), capture size 65535 bytes
13:14:57.129637 IP xxx.cfa.harvard.edu.47866 > js9.cfa.harvard.edu.pn-requester2: Flags [S], seq 2776976870, win 14600, options [mss 1460,sackOK,TS val 2676868477 ecr 0,nop,wscale 7], length 0
13:14:57.129756 IP xxx.cfa.harvard.edu.47866 > js9.cfa.harvard.edu.pn-requester2: Flags [.], ack 2040582056, win 115, options [nop,nop,TS val 2676868478 ecr 2469544775], length 0
13:14:57.130854 IP xxx.cfa.harvard.edu.60658 > js9.cfa.harvard.edu.ssh: Flags [.], ack 944320103, win 501, options [nop,nop,TS val 2676868479 ecr 2469544777], length 0
13:14:57.131863 IP xxx.cfa.harvard.edu.60658 > js9.cfa.harvard.edu.ssh: Flags [.], ack 213, win 501, options [nop,nop,TS val 2676868480 ecr 2469544778], length 0
13:14:57.132858 IP xxx.cfa.harvard.edu.60658 > js9.cfa.harvard.edu.ssh: Flags [.], ack 425, win 501, options [nop,nop,TS val 2676868481 ecr 2469544779], length 0
````
As I said, in my Mac to Linux case, there is an extra proxy host (xxx) that might be causing this particular setup to fail. I'll have to ask my systems group what they think ought to happen, but today is not a good day for questions ...

But if you can run tcpdump on your src and dst machines, you can at least check whether the packets being sent are being received. That would tell us a lot.

**Comment by ericmandel** [comment]
I found a way to create a direct proxy from Mac to Linux and it works fine: I load a page on my Mac which connects via ssh proxy to the Linux helper:

<img width="478" alt="screen shot 2018-08-02 at 6 37 04 am" src="https://user-images.githubusercontent.com/3028875/43579038-c6619dd2-961e-11e8-9300-34b517909067.png">

> But surely the firewall shouldn't enter into it if I'm tunneling through ssh... in fact that's the whole point of tunneling?

This does not seem to be true. When I first tried to set up a direct proxy from Mac to Linux, I ran the Linux js9 helper on port 2718. This did not work, because our firewall blocks that port by default. the tunnel only worked when I ran the helper on a port that was not blocked by the firewall.

**Comment by o-smirnov** [comment]
> This does not seem to be true. When I first tried to set up a direct proxy from Mac to Linux, I ran the Linux js9 helper on port 2718. This did not work, because our firewall blocks that port by default. ssh -N -f 

Ah wait, but that's just a quirk of your local setup. You're not tunneling all the way to the host running the helper. You're doing something like:
```
ssh -L localhost:2717:js9.si.edu:2718 eric@xxx.cfa.harvard.edu
```
...which means that your ssh end-point, xxx.cfa.hardvard.edu, is connecting to js9.si.edu:2718, so if there's a firewall in between those two machines, it can certainly get in the way.

I'm running something like
```
ssh -L localhost:11001:localhost:1025 oms@stills.ru.ac.za
```
...so I have an ssh connection directly to stills (where the helper is running). So stills connects to port 1025 on itself ("localhost:1015"). As far as any firewalls are concerned, all they see is ssh traffic between my laptop and stills.

I'm pretty sure the tunneling itself is OK -- I'm running all sorts of other services through it, with no problems whatsoever. And I can connect to the helper with wget just fine (see my comment here https://github.com/gijzelaerr/js9notebook/issues/5#issuecomment-409512444). So there's something odd in JS9 itself.

Can I run js9.js instead of js9.min.js, and start adding ``console.log`` statements? Not sure I'll have much time for it today though...

**Comment by ericmandel** [comment]
OK, thanks, I have verified that these both work, even though 2718 is blocked by the firewall:
````
ssh -N -f -L 2717:localhost:14285 eric@bokhara.cfa.harvard.edu
ssh -N -f -L 2717:localhost:2718 eric@bokhara.cfa.harvard.edu
````
I think using localhost instead of bokhara made it work on the otherwise blocked port 2718.

So can you, at your convenience, use tcpdump to make sure you are receiving the tcp packets on stills?

Yes, you can replace js9.min.js with js9.js but I don't know which console statement will help. Let me think whether I can come up with some debugging experiments. This error message:
````
JS9 helper connect error: timeout (or connection refused)
````
is just the error callback from the connect(), but perhaps there is something I can add to the xhr call itself ...

**Comment by o-smirnov** [comment]
Interesting. This is tcpdump on my laptop when J9 starts up:
```
$ sudo tcpdump -i lo "tcp port 11001"
10:54:38.691326 IP6 ip6-localhost.33330 > ip6-localhost.11001: Flags [S], seq 1594062229, win 43690, options [mss 65476,sackOK,TS val 12231557 ecr 0,nop,wscale 7], length 0
10:54:38.691340 IP6 ip6-localhost.11001 > ip6-localhost.33330: Flags [S.], seq 2972804348, ack 1594062230, win 43690, options [mss 65476,sackOK,TS val 12231557 ecr 12231557,nop,wscale 7], length 0
10:54:38.691352 IP6 ip6-localhost.33330 > ip6-localhost.11001: Flags [.], ack 1, win 342, options [nop,nop,TS val 12231557 ecr 12231557], length 0
10:54:38.691489 IP6 ip6-localhost.33330 > ip6-localhost.11001: Flags [P.], seq 1:3322, ack 1, win 342, options [nop,nop,TS val 12231557 ecr 12231557], length 3321
10:54:41.953580 IP6 ip6-localhost.11001 > ip6-localhost.33330: Flags [P.], seq 1:16385, ack 3322, win 1365, options [nop,nop,TS val 12232372 ecr 12231557], length 16384
10:54:41.953594 IP6 ip6-localhost.33330 > ip6-localhost.11001: Flags [.], ack 16385, win 1365, options [nop,nop,TS val 12232372 ecr 12232372], length 0
10:54:41.954896 IP6 ip6-localhost.11001 > ip6-localhost.33330: Flags [P.], seq 16385:32769, ack 3322, win 1365, options [nop,nop,TS val 12232373 ecr 12232372], length 16384
10:54:41.954911 IP6 ip6-localhost.33330 > ip6-localhost.11001: Flags [.], ack 32769, win 2388, options [nop,nop,TS val 12232373 ecr 12232373], length 0
10:54:41.955056 IP6 ip6-localhost.11001 > ip6-localhost.33330: Flags [P.], seq 32769:49153, ack 3322, win 1365, options [nop,nop,TS val 12232373 ecr 12232373], length 16384
10:54:41.955062 IP6 ip6-localhost.33330 > ip6-localhost.11001: Flags [.], ack 49153, win 3410, options [nop,nop,TS val 12232373 ecr 12232373], length 0
10:54:41.955153 IP6 ip6-localhost.11001 > ip6-localhost.33330: Flags [P.], seq 49153:62613, ack 3322, win 1365, options [nop,nop,TS val 12232373 ecr 12232373], length 13460
10:54:46.955478 IP6 ip6-localhost.11001 > ip6-localhost.33330: Flags [F.], seq 62613, ack 3322, win 1365, options [nop,nop,TS val 12233623 ecr 12232373], length 0
10:54:46.994726 IP6 ip6-localhost.33330 > ip6-localhost.11001: Flags [.], ack 62614, win 3636, options [nop,nop,TS val 12233633 ecr 12233623], length 0
10:55:31.982760 IP6 ip6-localhost.33330 > ip6-localhost.11001: Flags [.], ack 62614, win 3636, options [nop,nop,TS val 12244880 ecr 12233623], length 0
10:55:31.982772 IP6 ip6-localhost.11001 > ip6-localhost.33330: Flags [.], ack 3322, win 1365, options [nop,nop,TS val 12244880 ecr 12233633], length 0
10:55:37.471712 IP6 ip6-localhost.33330 > ip6-localhost.11001: Flags [F.], seq 3322, ack 62614, win 3636, options [nop,nop,TS val 12246252 ecr 12244880], length 0
10:55:37.471731 IP6 ip6-localhost.11001 > ip6-localhost.33330: Flags [.], ack 3323, win 1365, options [nop,nop,TS val 12246252 ecr 12246252], length 0
```
And this is what I see on stills:
```
0:54:40.271290 IP6 localhost.55334 > localhost.1025: Flags [S], seq 607750725, win 43690, options [mss 65476,sackOK,TS val 1386531999 ecr 0,nop,wscale 7], length 0
10:54:40.271299 IP6 localhost.1025 > localhost.55334: Flags [R.], seq 0, ack 607750726, win 0, length 0
10:54:40.271409 IP localhost.44736 > localhost.1025: Flags [S], seq 725647229, win 43690, options [mss 65495,sackOK,TS val 1386531999 ecr 0,nop,wscale 7], length 0
10:54:40.271423 IP localhost.1025 > localhost.44736: Flags [S.], seq 2447566619, ack 725647230, win 43690, options [mss 65495,sackOK,TS val 1386531999 ecr 1386531999,nop,wscale 7], length 0
10:54:40.271435 IP localhost.44736 > localhost.1025: Flags [.], ack 1, win 342, options [nop,nop,TS val 1386531999 ecr 1386531999], length 0
10:54:41.885465 IP localhost.44736 > localhost.1025: Flags [P.], seq 1:3322, ack 1, win 342, options [nop,nop,TS val 1386532402 ecr 1386531999], length 3321
10:54:41.885477 IP localhost.1025 > localhost.44736: Flags [.], ack 3322, win 1365, options [nop,nop,TS val 1386532402 ecr 1386532402], length 0
10:54:41.886100 IP localhost.1025 > localhost.44736: Flags [.], seq 1:21889, ack 3322, win 1365, options [nop,nop,TS val 1386532402 ecr 1386532402], length 21888
10:54:41.886118 IP localhost.44736 > localhost.1025: Flags [.], ack 21889, win 1365, options [nop,nop,TS val 1386532402 ecr 1386532402], length 0
10:54:41.886147 IP localhost.1025 > localhost.44736: Flags [P.], seq 21889:43777, ack 3322, win 1365, options [nop,nop,TS val 1386532402 ecr 1386532402], length 21888
10:54:41.886155 IP localhost.44736 > localhost.1025: Flags [.], ack 43777, win 2388, options [nop,nop,TS val 1386532402 ecr 1386532402], length 0
10:54:41.886179 IP localhost.1025 > localhost.44736: Flags [P.], seq 43777:62613, ack 3322, win 1365, options [nop,nop,TS val 1386532402 ecr 1386532402], length 18836
10:54:41.886186 IP localhost.44736 > localhost.1025: Flags [.], ack 62613, win 3411, options [nop,nop,TS val 1386532402 ecr 1386532402], length 0
10:54:46.891675 IP localhost.1025 > localhost.44736: Flags [F.], seq 62613, ack 3322, win 1365, options [nop,nop,TS val 1386533654 ecr 1386532402], length 0
10:54:46.930355 IP localhost.44736 > localhost.1025: Flags [.], ack 62614, win 3411, options [nop,nop,TS val 1386533664 ecr 1386533654], length 0
10:55:38.475411 IP localhost.44736 > localhost.1025: Flags [F.], seq 3322, ack 62614, win 3411, options [nop,nop,TS val 1386546550 ecr 1386533654], length 0
10:55:38.475426 IP localhost.1025 > localhost.44736: Flags [.], ack 3323, win 1365, options [nop,nop,TS val 1386546550 ecr 1386546550], length 0
```
The only obvious difference is that some packets from stills seem to be longer than the ones arriving on my laptop. Length being truncated at 16384?

**Comment by o-smirnov** [comment]
Actually nevermind the packet size -- the sum of the response packet sizes is 62612 in both cases, so it's the same length message coming back. 

Anyway, I'm convinced traffic from the helper is getting back properly (and remember, I can use wget to talk to it without a problem...)

**Comment by ericmandel** [comment]
OK, thanks, it's good to verify that the packets are arriving ... now all we need to do is understand why the helper is not seeing them.

I can't work on this right now, I'm buried deep in a problem with the socket.io fall-back transport mechanism (long-polling) . Don't ask why ... just know there are a lot of ways to (mis-)configure a web site!

**Comment by ericmandel** [comment]
````
  socket.io:server serve client source +27s
  socket.io:server serve client 304 +1s
````
I'm back ... these two messages above are output in a socket.io routine called Server.prototype.serve that serves socket.io.js back to the client. Once the browser has retrieved socket.io.js, it tries to connect to the server ... and the error you are seeing indicates its inability to connect.

We do see TCP packets going to port 1025 on stills, although there is no indication that the js9 helper is processing these TCP packets. We also see TCP packets going from 1025  on stills back to the other machine, but we still get a timeout.

Would that be a fair summary? If so, I have no idea (yet) what is going on.

**Comment by ericmandel** [comment]
When you start up the helper on stills, did you change the helperHost value or leave it as 0.0.0.0? That is, is the helper listening on all IP addresses (0.0.0.0) or a particular IP address?

**Comment by ericmandel** [comment]
Also, I see very few web pages returned when I google:
````
socket.io ipv6
````
Any chance you can try downgrading to ipv4?

**Comment by o-smirnov** [comment]
Ahh, ipv6. That's an idea. I'll take a look when I get back to my computer.
Might not be until tomorrow though.

Cheers,
Oleg

---
Sent from my phone. Quality of spelling inversely proportional to finger
size.

**Comment by o-smirnov** [comment]
> Would that be a fair summary? If so, I have no idea (yet) what is going on.

Yep, fair summary.

Tried it with IPv6 disabled, get the same problem, sadly...

> When you start up the helper on stills, did you change the helperHost value or leave it as 0.0.0.0? That is, is the helper listening on all IP addresses (0.0.0.0) or a particular IP address?

0.0.0.0. But I changed it to 127.0.0.1 just in case, it didn't help.

What really intrigues me is that roughly 20% of the time it will connect successfully....

**Comment by ericmandel** [comment]
> What really intrigues me is that roughly 20% of the time it will connect successfully....

Is the helper started up on the fly?

**Comment by ericmandel** [comment]
(oops, didn't mean to make that a comment by itself)

I agree that the 20% looks like a timing issue. If the helper is being started on the fly, perhaps you can start it manually instead (as a test) and see if it always connects.

**Comment by o-smirnov** [comment]
Already tried that... anyway, it starts long before any request is made (Jupyter itself takes a while to come up, especially over a remote conection, and the helper is started first). 

And it **always** successfully serves socket.io.js back to the client. It's just the subsequent bit that goes wrong.

**Comment by ericmandel** [comment]
> And it always successfully serves socket.io.js back to the client. 

I'm a little confused. Above you mentioned that DEBUG=* showed only two messages:
````
  socket.io:server serve client source +27s
  socket.io:server serve client 304 +1s
````
It doesn't seem like this would result in the return of the socket.io.js file, or else I would have expected more output from DEBUG=*. My output (up to the first js9 "initialize" message) is below, which seems to include the initial processing before a connect request.
````
  socket.io:server serve client source +13s
  engine intercepting request for path "/socket.io/" +0ms
  engine handling "GET" http request "/socket.io/?EIO=3&transport=polling&t=MK5AT5E" +0ms
  engine handshaking client "IXyG7sMgqZBGt_sMAAAA" +3ms
  engine:socket sending packet "open" ({"sid":"IXyG7sMgqZBGt_sMAAAA","upgrades":["websocket"],"pingInterval":25000,"pingTimeout":5000}) +0ms
  engine:socket sending packet "message" (0) +0ms
  engine:polling setting request +0ms
  engine:socket flushing buffer to transport +1ms
  engine:polling writing "96:0{"sid":"IXyG7sMgqZBGt_sMAAAA","upgrades":["websocket"],"pingInterval":25000,"pingTimeout":5000}2:40" +1ms
  engine:socket executing batch send callback +2ms
  socket.io:server incoming connection with id IXyG7sMgqZBGt_sMAAAA +110ms
  socket.io:client connecting to namespace / +0ms
  socket.io:namespace adding socket to nsp / +0ms
  socket.io:socket socket connected - writing packet +0ms
  socket.io:socket joining room IXyG7sMgqZBGt_sMAAAA +0ms
  socket.io:socket packet already sent in initial handshake +0ms
  socket.io:socket joined room IXyG7sMgqZBGt_sMAAAA +1ms
  engine upgrading existing transport +256ms
  engine:socket might upgrade socket transport from "polling" to "websocket" +253ms
  engine intercepting request for path "/socket.io/" +3ms
  engine handling "POST" http request "/socket.io/?EIO=3&transport=polling&t=MK5AT9H&sid=IXyG7sMgqZBGt_sMAAAA" +0ms
  engine setting new request for existing client +0ms
  engine:polling received "52:420["initialize",{"displays":["JS9"],"pageid":null}]" +257ms
````

**Comment by ericmandel** [comment]
This page https://socket.io/docs/logging-and-debugging/ tells us that we can add debugging statements to the client in this way:
````
localStorage.debug = '*';
````
When I did this, I do get some beautiful console log statements (I again end at the point where JS9 sends its "initialize" message):
<img width="957" alt="screen shot 2018-08-04 at 10 01 25 am" src="https://user-images.githubusercontent.com/3028875/43677288-6ae5745a-97cd-11e8-9aa9-ea66d9c5f3d5.png">

**Comment by o-smirnov** [comment]
> I'm a little confused. Above you mentioned that DEBUG=* showed only two messages:

That is correct. But from your comment [here](https://github.com/gijzelaerr/js9notebook/issues/5#issuecomment-410340566) I assumed that that meant socket.io.js was being successfully returned. So let me put it more precisely: those two messages (whatever they mean) appear with 100% reliability. A subsequent helper connection is established with ~20% reliability.

I happened to stumble on something interesting just now though. If I run the helper like this:

```
DEBUG='*'  /usr/bin/nodejs /home/oms/.radiopadre-venv/js9-www/js9Helper.js '{"helperPort": 1025, "helperOpts":{"transports":["polling"],"maxHttpBufferSize": 10E9}}'
```

...then the connection is 100% reliable! Without ``DEBUG='*'``, it gets flaky again. (My previous runs with ``DEBUG='*'`` were without the long polling options.)

**Comment by o-smirnov** [comment]
Gotta leave the computer for today, but I think we're getting somewhere... I'll enable debugging and report tomorrow...

**Comment by ericmandel** [comment]
OK, I have no idea what is going on, but the client debugging (with and without setting the transport value set to polling) will tell us some good stuff. It stinks of a race condition, though.

I'll be away from computers from early tomorrow until Monday evening, and will pick up when I return. (I will read emails on my phone but not much more ...)

**Comment by o-smirnov** [comment]
Well I'm technically on leave now so I'm in no hurry. But I'll check the
debug output when all the vacationing gets too boring.

**Comment by ericmandel** [comment]
Well, given that we are more or less cut from the same cloth, we probably should try to avoid pushing one another during vacation time. Let me know when you want to start up ... I'm not in a hurry either, except to make sure your needs are taken care of.

**Comment by o-smirnov** [comment]
> It stinks of a race condition, though.

I agree with your olfactory diagnosis. I got the browser to log debug statements. With debugging on, it tends to connect successfully more frequently (same observation with server-side debugging above).

Maddeningly, when it does fail to connect, there is **nothing at all** in the log from socket.io -- just the "helper connect error: timeout or connection refused" message straight up. When it succeeds, I get the following (note the connect/reconnect messages...)

```
registering JS9 partner display plug-in
socket.io.js?v=20180811133135:6 socket.io-client:url parse http://localhost:11001 +0ms
socket.io.js?v=20180811133135:6 socket.io-client new io instance for http://localhost:11001 +0ms
socket.io.js?v=20180811133135:6 socket.io-client:manager readyState closed +0ms
socket.io.js?v=20180811133135:6 socket.io-client:manager opening http://localhost:11001 +1ms
socket.io.js?v=20180811133135:6 engine.io-client:socket creating transport "polling" +0ms
socket.io.js?v=20180811133135:6 engine.io-client:polling polling +0ms
socket.io.js?v=20180811133135:6 engine.io-client:polling-xhr xhr poll +0ms
socket.io.js?v=20180811133135:6 engine.io-client:polling-xhr xhr open GET: http://localhost:11001/socket.io/?EIO=3&transport=polling&t=MKenbf1 +3ms
socket.io.js?v=20180811133135:6 engine.io-client:polling-xhr xhr data null +0ms
socket.io.js?v=20180811133135:6 engine.io-client:socket setting transport polling +6ms
socket.io.js?v=20180811133135:6 socket.io-client:manager connect attempt will timeout after 1000 +9ms
socket.io.js?v=20180811133135:6 socket.io-client:manager readyState opening +1ms
socket.io.js?v=20180811133135:6 socket.io-client:manager connect attempt timed out after 1000 +1s
socket.io.js?v=20180811133135:6 engine.io-client:socket socket close with reason: "forced close" +1s
socket.io.js?v=20180811133135:6 engine.io-client:polling transport not open - deferring close +1s
socket.io.js?v=20180811133135:6 engine.io-client:socket socket closing - telling transport to close +1ms
socket.io.js?v=20180811133135:6 socket.io-client:manager connect_error +1ms
socket.io.js?v=20180811133135:6 socket.io-client:manager cleanup +0ms
VM712:424 JS9 helper: connect error
socket.io.js?v=20180811133135:6 socket.io-client:manager will wait 855ms before reconnect attempt +1ms
VM712:424 JS9 helper: connect timeout
socket.io.js?v=20180811133135:6 engine.io-client:polling polling got data 96:0{"sid":"xv3hw4EYNzONzvTyAAAA","upgrades":["websocket"],"pingInterval":25000,"pingTimeout":5000}2:40 +393ms
socket.io.js?v=20180811133135:6 socket.io-client:manager attempting reconnect +998ms
socket.io.js?v=20180811133135:6 socket.io-client:manager readyState closed +4ms
socket.io.js?v=20180811133135:6 socket.io-client:manager opening http://localhost:11001 +0ms
socket.io.js?v=20180811133135:6 engine.io-client:socket creating transport "polling" +1s
socket.io.js?v=20180811133135:6 engine.io-client:polling polling +612ms
socket.io.js?v=20180811133135:6 engine.io-client:polling-xhr xhr poll +2s
socket.io.js?v=20180811133135:6 engine.io-client:polling-xhr xhr open GET: http://localhost:11001/socket.io/?EIO=3&transport=polling&t=MKencAc +0ms
socket.io.js?v=20180811133135:6 engine.io-client:polling-xhr xhr data null +1ms
socket.io.js?v=20180811133135:6 engine.io-client:socket setting transport polling +3ms
socket.io.js?v=20180811133135:6 socket.io-client:manager connect attempt will timeout after 1000 +6ms
socket.io.js?v=20180811133135:6 engine.io-client:polling polling got data 96:0{"sid":"-GSbGnkFuUL2f30nAAAB","upgrades":["websocket"],"pingInterval":25000,"pingTimeout":5000}2:40 +769ms
socket.io.js?v=20180811133135:6 engine.io-client:socket socket receive: type "open", data "{"sid":"-GSbGnkFuUL2f30nAAAB","upgrades":["websocket"],"pingInterval":25000,"pingTimeout":5000}" +767ms
socket.io.js?v=20180811133135:6 engine.io-client:socket socket open +0ms
socket.io.js?v=20180811133135:6 socket.io-client:manager open +767ms
socket.io.js?v=20180811133135:6 socket.io-client:manager cleanup +1ms
socket.io.js?v=20180811133135:6 socket.io-client:socket transport is open - connecting +0ms
socket.io.js?v=20180811133135:6 socket.io-client:manager reconnect success +1ms
VM712:424 JS9 helper: reconnect
socket.io.js?v=20180811133135:6 engine.io-client:socket starting upgrade probes +4ms
socket.io.js?v=20180811133135:6 engine.io-client:socket probing transport "websocket" +0ms
socket.io.js?v=20180811133135:6 engine.io-client:socket creating transport "websocket" +1ms
socket.io.js?v=20180811133135:6 engine.io-client:socket socket receive: type "message", data "0" +2ms
socket.io.js?v=20180811133135:6 socket.io-parser decoded 0 as {"type":0,"nsp":"/"} +0ms
socket.io.js?v=20180811133135:6 socket.io-client:socket emitting packet with ack id 0 +11ms
socket.io.js?v=20180811133135:6 socket.io-client:manager writing packet {"type":2,"data":["initialize",{"displays":[]}],"options":{"compress":true},"id":0,"nsp":"/"} +12ms
socket.io.js?v=20180811133135:6 socket.io-parser encoding packet {"type":2,"data":["initialize",{"displays":[]}],"options":{"compress":true},"id":0,"nsp":"/"} +6ms
socket.io.js?v=20180811133135:6 socket.io-parser encoded {"type":2,"data":["initialize",{"displays":[]}],"options":{"compress":true},"id":0,"nsp":"/"} as 20["initialize",{"displays":[]}] +3ms
socket.io.js?v=20180811133135:6 engine.io-client:socket flushing 1 packets in socket +11ms
socket.io.js?v=20180811133135:6 engine.io-client:polling-xhr xhr open POST: http://localhost:11001/socket.io/?EIO=3&transport=polling&t=MKencMw&sid=-GSbGnkFuUL2f30nAAAB +788ms
socket.io.js?v=20180811133135:6 engine.io-client:polling-xhr xhr data 33:420["initialize",{"displays":[]}] +0ms
socket.io.js?v=20180811133135:6 engine.io-client:polling polling +23ms
socket.io.js?v=20180811133135:6 engine.io-client:polling-xhr xhr poll +6ms
socket.io.js?v=20180811133135:6 engine.io-client:polling-xhr xhr open GET: http://localhost:11001/socket.io/?EIO=3&transport=polling&t=MKencN1&sid=-GSbGnkFuUL2f30nAAAB +0ms
socket.io.js?v=20180811133135:6 engine.io-client:polling-xhr xhr data null +2ms
socket.io.js?v=20180811133135:6 engine.io-client:polling polling got data 94:430[{"pageid":"448a5df8-11a6-4ea6-9890-cd5b11dc46d3","js9helper":false,"dataPathModify":true}] +794ms
socket.io.js?v=20180811133135:6 engine.io-client:socket socket receive: type "message", data "30[{"pageid":"448a5df8-11a6-4ea6-9890-cd5b11dc46d3","js9helper":false,"dataPathModify":true}]" +799ms
socket.io.js?v=20180811133135:6 socket.io-parser decoded 30[{"pageid":"448a5df8-11a6-4ea6-9890-cd5b11dc46d3","js9helper":false,"dataPathModify":true}] as {"type":3,"nsp":"/","id":0,"data":[{"pageid":"448a5df8-11a6-4ea6-9890-cd5b11dc46d3","js9helper":false,"dataPathModify":true}]} +801ms
socket.io.js?v=20180811133135:6 socket.io-client:socket calling ack 0 with [{"pageid":"448a5df8-11a6-4ea6-9890-cd5b11dc46d3","js9helper":false,"dataPathModify":true}] +809ms
VM712:424 JS9 helper: connect: nodejs
socket.io.js?v=20180811133135:6 engine.io-client:polling polling +8ms
socket.io.js?v=20180811133135:6 engine.io-client:polling-xhr xhr poll +798ms
socket.io.js?v=20180811133135:6 engine.io-client:polling-xhr xhr open GET: http://localhost:11001/socket.io/?EIO=3&transport=polling&t=MKencZX&sid=-GSbGnkFuUL2f30nAAAB +0ms
socket.io.js?v=20180811133135:6 engine.io-client:polling-xhr xhr data null +1ms
socket.io.js?v=20180811133135:6 engine.io-client:socket probe transport "websocket" opened +739ms
socket.io.js?v=20180811133135:6 engine.io-client:socket probe transport "websocket" pong +703ms
socket.io.js?v=20180811133135:6 engine.io-client:socket pausing current transport "polling" +0ms
socket.io.js?v=20180811133135:6 engine.io-client:polling we are currently polling - waiting to pause +1s
socket.io.js?v=20180811133135:6 engine.io-client:polling polling got data 1:6 +100ms
socket.io.js?v=20180811133135:6 engine.io-client:socket socket receive: type "noop", data "undefined" +102ms
socket.io.js?v=20180811133135:6 engine.io-client:polling pre-pause polling complete +2ms
socket.io.js?v=20180811133135:6 engine.io-client:polling paused +0ms
socket.io.js?v=20180811133135:6 engine.io-client:socket changing transport and sending upgrade packet +1ms
socket.io.js?v=20180811133135:6 engine.io-client:socket setting transport websocket +0ms
socket.io.js?v=20180811133135:6 engine.io-client:socket clearing existing transport polling +1ms
socket.io.js?v=20180811133135:6 engine.io-client:polling ignoring poll - transport state "paused" +3ms
socket.io.js?v=20180811133135:6 engine.io-client:socket writing ping packet - expecting pong within 5000ms +23s
socket.io.js?v=20180811133135:6 engine.io-client:socket flushing 1 packets in socket +2ms
socket.io.js?v=20180811133135:6 engine.io-client:socket socket receive: type "pong", data "undefined" +709ms
socket.io.js?v=20180811133135:6 engine.io-client:socket writing ping packet - expecting pong within 5000ms +25s
socket.io.js?v=20180811133135:6 engine.io-client:socket flushing 1 packets in socket +1ms
socket.io.js?v=20180811133135:6 engine.io-client:socket socket receive: type "pong", data "undefined" +736ms
socket.io.js?v=20180811133135:6 engine.io-client:socket writing ping packet - expecting pong within 5000ms +25s
socket.io.js?v=20180811133135:6 engine.io-client:socket flushing 1 packets in socket +1ms
socket.io.js?v=20180811133135:6 engine.io-client:socket socket receive: type "pong", data "undefined" +470ms
socket.io.js?v=20180811133135:6 engine.io-client:socket writing ping packet - expecting pong within 5000ms +26s
socket.io.js?v=20180811133135:6 engine.io-client:socket flushing 1 packets in socket +1ms
socket.io.js?v=20180811133135:6 engine.io-client:socket socket receive: type "pong", data "undefined" +702ms
socket.io.js?v=20180811133135:6 engine.io-client:socket writing ping packet - expecting pong within 5000ms +25s
socket.io.js?v=20180811133135:6 engine.io-client:socket flushing 1 packets in socket +1ms
socket.io.js?v=20180811133135:6 engine.io-client:socket socket receive: type "pong", data "undefined" +710ms
socket.io.js?v=20180811133135:6 engine.io-client:socket writing ping packet - expecting pong within 5000ms +25s
socket.io.js?v=20180811133135:6 engine.io-client:socket flushing 1 packets in socket +0ms
socket.io.js?v=20180811133135:6 engine.io-client:socket socket receive: type "pong", data "undefined" +693ms
```
And even with a successful connection, it's still not invoking fits2fits, and trying to download full images. Is it unable to find the helper shell script perhaps? (It would be nice BTW if this condition also displayed an error when ``requireHelper=true``). This is the exchange I see in the log:

![image](https://user-images.githubusercontent.com/6470079/43991536-2c7de204-9d6f-11e8-85e8-73a45b10c4a0.png)

**Comment by ericmandel** [comment]
> Maddeningly, when it does fail to connect, there is nothing at all in the log from socket.io 

And, on the server side, on a connect failure, all you see is this, right?
````
  socket.io:server serve client source +27s
  socket.io:server serve client 304 +1s
````
If so, this is consistent with the unix system call connect() not actually connecting to a socket, and eventually timing out -- and this failure/timeout is independent of the implementation in which its embedded. (See https://github.com/ericmandel/xpa for a socket-based communication mechanism from the 90's, still in heavy use in xray astronomy -- man, I tripped over every problem imaginable back then). 

Why is the connect just hanging and not connecting?? Especially when you see the TCP packets arriving on the server side!

Have you tried executing netstat on the server side:
````
netstat -an | egrep 2718
````
(or whatever port you are using to listen to). I'd be interested to know what is listening.

I assume you won't find that port in a TIME_WAIT state ... that would be a problem.

I'm starting to wonder if we need to replace the helper with another socket-based server to see what is happening at connect time. It doesn't seem like this is a socket.io problem, but only a replacement server will tell us that for sure.

**Comment by ericmandel** [comment]
> socket.io.js?v=20180811133135:6 socket.io-client:manager connect attempt will timeout after 1000 +6ms

Also, let's try increasing the connect timeout, which is controlled by these globalOpts variables (probably the second, in your case):
````
    htimeout: 5000,		// connection timeout for the helper connect
    lhtimeout: 1000,		// connection timeout for local helper connect
````
Try:
````
    JS9.globalOpts.htimeout = 10000
    JS9.globalOpts.lhtimeout = 10000
````
Perhaps a miracle will happen.

I envy the fact that you got to attend the commissioning of Meerkat during the day. I guess I'll try to get up at 3am again to see Parker Solar Probe launch (my division built SWEAP, although my only real contact with that project is through my friend, SWEAP's long-long-suffering grant administrator) but I can't guarantee it.

**Comment by o-smirnov** [comment]
> Perhaps a miracle will happen.

BINGO! That's exactly what has happened. Seems 100% reliable now.

And it makes perfect sense in hindsight -- initialization of the whole thing (Jupyter+JS9) via the tunnel takes a while, and there's a lot of latency in opening up new connections in particular... so that 1s was too optimistic...
 
Right, new problems coming up soon though. :)

> I envy the fact that you got to attend the commissioning of Meerkat during the day. 

Yes, it was a pretty special event. Nothing quite like standing among a mob of radio dishes tracking around in unison... ;)

**Comment by ericmandel** [comment]
Whoah,  that was hard to find! I've increased the timeout to 10 seconds everywhere, so hopefully this won't happen again.

And I'll look forward to some non-race-condition problems ...

**Comment by o-smirnov** [comment]
> And I'll look forward to some non-race-condition problems ...

Be careful what you wish for! Here's one coming right up. I've broken something again in the Load() call. At the moment it looks like this:
```javascript
    opts = {fits2fits:true, xcen:(xsz/2>>0), ycen:(ysz/2>>0), xdim:xsz, ydim:ysz, bin:bin,
            onload: im => this.onLoadRebin(im, xsz, ysz),
            zoom:'T'}
    this.setDefaultImageOpts(opts)
    JS9p.log("Loading", path, "with options", opts)
    JS9.Load(path, opts, {display:this.disp_rebin});
```
And here's the console output:

![image](https://user-images.githubusercontent.com/6470079/44002105-f6aeeb30-9e3d-11e8-87ff-48c182038a42.png)

The opts object looks OK to me (there are some extra fields in a misguided effort to set the initial clipping limits). And yet, it no longer calls the helper to get the rebinned image. It just silently falls back to getting a full image (I opened an issue about the silent part in https://github.com/ericmandel/js9/issues/42).

The helper itself is configured correctly though -- when it goes to load a zoomed section later, I can see js9Xeq being invoked.

**Comment by ericmandel** [comment]
> BINGO! That's exactly what has happened. Seems 100% reliable now.
> Whoah, that was hard to find! I've increased the timeout to 10 seconds everywhere, so hopefully this won't happen again.

On reflection, you should explicitly set JS9.globalOpts.lhtimeout to a value that makes sense for you. I now have it set to 10 seconds, but that will cause other problems: if a local helper is expected but is not running, there will be a 10 second delay before JS9 recovers and moves on without the helper. I'll need to see if anyone complains  -- this might just be my debugging setup, but setting the timeout value yourself will be safest.

**Comment by o-smirnov** [comment]
OK, with the new requireFits2Fits mode, the reason became immediately apparent. The problem was with the ``http://localhost`` prefix on the image URL. If I'm always going via the helper, I should never have that prefix on the image...

Everything seems to work again now, so I'll close this thread, as it's getting unwieldy anyway. I'll open new ones when I break something else.
